{
  "schema_version": "1.0",
  "run_id": "cs-ba9a17d0ec14",
  "summary": "30 findings reviewed across s3 (8), lambda (5), rds (11), and cloudwatch (6). Lambda rightsizing and RDS Multi-AZ findings are well-evidenced and correctly priced via the public pricing waterfall. Two structural issues found: RDS R1/R2 alternatives on the same three instances are not mutually exclusive in the totals, and all six CloudWatch retention findings report stored_bytes=0, which may mean there is no cost to actually recover yet.",
  "review_notes": [
    "RDS_R1_NONPROD_MULTI_AZ and RDS_R2_LOW_UTILIZATION are computed independently on the same three instances (dev_analytics_db_64c7c4dc, dev_reporting_db_2b0272f3, staging_cache_db_19cba437). R1 assumes the instance stays at its current class and only Multi-AZ is removed; R2 assumes Multi-AZ stays on and only the instance class shrinks. These are alternative remediation paths from the same baseline, not additive -- report R1 as evidence-backed savings and keep R2 as separate reasonable-estimate upside unless a reviewer explicitly chooses the downsizing path instead.",
    "prod_api_db_0e77730c correctly has no R1 finding (production, Multi-AZ retained) -- consistent with the R1 rule only firing on non-production instances.",
    "Lambda cross-domain refs (waste_email_sender, waste_thumbnail_gen) to their CloudWatch log groups are backed by observed dependency_facts with fact_ids -- safe to treat as observed, not hypothesis.",
    "The three cloudwatch_retention_review hypotheses (app_access_logs, app_debug_logs, aws_ecs_staging_service) correctly stay as unconfirmed hypotheses with no fact_ids -- no compute/RDS association was observed for them, so they should not be escalated to observed cross-domain statements.",
    "RDS Reserved Instance coverage (rule R3) was correctly not raised as a finding for prod_api_db_0e77730c: cost_report.json is absent, so there is no billing evidence to confirm an on-demand-only baseline. Raising R3 here would be speculation, not a finding."
  ],
  "quality_flags": [
    "All 6 CloudWatch log-group retention findings (CLOUDWATCH_RETENTION_POLICY:C1) report stored_bytes=0. A log group with zero stored bytes has no storage cost to recover today, so setting a retention policy on it is a preventive/governance action, not a monthly-savings action -- confirm this is a metrics collection gap (e.g. logs written after the collection window) rather than genuinely empty groups before representing these as cost-saving candidates in the same table as priced findings.",
    "All 8 S3 lifecycle findings and the RDS R2/R5 findings on prod_api_db_0e77730c are unmeasured for the same root cause (bucket_size / IOPS-storage evidence not collected) -- this is a data-collection gap on the MiniStack/metrics side, not a detection weakness; worth noting as a follow-up evidence request rather than closing these out as no-waste.",
    "Lambda finding cs-d45e08bd096c (waste-notification-push) carries evidence value trigger=waste_name_lte_35_pct. This reads like a mislabeled trigger constant (compare to the other four Lambda findings' trigger=p99_memory_lte_25_pct) rather than a real metric name. It does not affect the priced savings figure, but the label should be corrected in the rule engine so evidence stays legible."
  ],
  "missed_candidate_hypotheses": []
}
